<?xml version="1.0" encoding="UTF-8" standalone="no"?>
<!DOCTYPE query SYSTEM "query.dtd">

<query>
<title>Samba User List</title>
<bases>
	<base></base>
</bases>
<filter><![CDATA[(&(|(objectClass=sambaAccount)(objectClass=sambaSamAccount))(objectClass=posixAccount)(!(uid=*$)))]]></filter>
<description>Samba Users</description>
<icon>ldap-user.png</icon>
<scope>sub</scope>
<visible>1</visible>

<attributes>
<attribute id="cn">
	<display>Common Name</display>
	<order>1</order>
	<ordersort>2</ordersort>
</attribute>
<attribute id="uid">
	<display>User ID</display>
	<order>2</order>
	<ordersort>1</ordersort>
</attribute>
<attribute id="sambaHomeDrive">
	<display>Samba Home Directory</display>
	<order>3</order>
	<ordersort>3</ordersort>
</attribute>
</attributes>
</query>
